{"$schema":"https://json-schema.org/draft/2020-12/schema","$id":"https://github.com/Lightning-Public/ane-context-ai/schemas/review-record.schema.json","title":"ANE Human or AI Review Record","type":"object","additionalProperties":false,"required":["id","schema_version","created_at","target","reviewer","reviewed_at","scope","findings","rights","decision","decision_notes","signature"],"properties":{"id":{"type":"string","minLength":1},"schema_version":{"const":"0.1.0"},"created_at":{"type":"string","format":"date-time"},"target":{"type":"object","additionalProperties":false,"required":["type","ids"],"properties":{"type":{"enum":["context_package","artifact"]},"ids":{"type":"array","minItems":1,"uniqueItems":true,"items":{"type":"string","minLength":1}}}},"reviewer":{"type":"object","additionalProperties":false,"required":["identity_type","name","identifier","role","expertise","affiliation"],"properties":{"identity_type":{"enum":["human","ai_assistant"]},"name":{"type":"string","minLength":1},"identifier":{"type":["string","null"],"minLength":1},"role":{"type":"string","minLength":1},"expertise":{"type":"array","minItems":1,"uniqueItems":true,"items":{"type":"string","minLength":1}},"affiliation":{"type":["string","null"],"minLength":1}}},"reviewed_at":{"type":"string","format":"date-time"},"scope":{"type":"object","additionalProperties":false,"required":["evidence_ids","artifact_ids","locators","editions_consulted"],"properties":{"evidence_ids":{"type":"array","uniqueItems":true,"items":{"type":"string","minLength":1}},"artifact_ids":{"type":"array","uniqueItems":true,"items":{"type":"string","minLength":1}},"locators":{"type":"array","uniqueItems":true,"items":{"type":"string","minLength":1}},"editions_consulted":{"type":"array","items":{"type":"object","additionalProperties":false,"required":["citation","locator"],"properties":{"citation":{"type":"string","minLength":1},"locator":{"type":"string","minLength":1}}}}}},"findings":{"type":"array","items":{"type":"object","additionalProperties":false,"required":["kind","summary","blocking","evidence_ids","represented_in"],"properties":{"kind":{"enum":["agreement","correction","disagreement","rights","limitation","other"]},"summary":{"type":"string","minLength":1},"blocking":{"type":"boolean"},"evidence_ids":{"type":"array","uniqueItems":true,"items":{"type":"string","minLength":1}},"represented_in":{"type":"array","uniqueItems":true,"items":{"type":"string","minLength":1}}}}},"rights":{"type":"object","additionalProperties":false,"required":["attribution_checked","reuse_checked","notes"],"properties":{"attribution_checked":{"type":"boolean"},"reuse_checked":{"type":"boolean"},"notes":{"type":"array","items":{"type":"string","minLength":1}}}},"decision":{"enum":["approve","needs_revision","reject"]},"decision_notes":{"type":"array","minItems":1,"items":{"type":"string","minLength":1}},"signature":{"type":"object","additionalProperties":false,"required":["method","identifier"],"properties":{"method":{"enum":["github_account","github_issue","git_commit","orcid","other"]},"identifier":{"type":"string","minLength":1}}}}}
