{"id":"review:REPLACE_WITH_STABLE_ID","schema_version":"0.1.0","created_at":"2026-08-21T00:00:00Z","target":{"type":"context_package","ids":["REPLACE_WITH_TARGET_ID"]},"reviewer":{"identity_type":"human","name":"REPLACE_WITH_REVIEWER_NAME","identifier":"REPLACE_WITH_ORCID_OR_STABLE_ACCOUNT","role":"REPLACE_WITH_DOMAIN_ROLE","expertise":["REPLACE_WITH_EXPERTISE"],"affiliation":null},"reviewed_at":"2026-08-21T00:00:00Z","scope":{"evidence_ids":["REPLACE_WITH_EVIDENCE_ID"],"artifact_ids":["REPLACE_WITH_ARTIFACT_ID"],"locators":["REPLACE_WITH_EXACT_LINE_OR_PLATE"],"editions_consulted":[{"citation":"REPLACE_WITH_EDITION","locator":"REPLACE_WITH_PAGE_OR_PLATE"}]},"findings":[{"kind":"limitation","summary":"REPLACE_WITH_FINDING","blocking":true,"evidence_ids":["REPLACE_WITH_EVIDENCE_ID"],"represented_in":["REPLACE_WITH_PACKAGE_JSON_POINTER_OR_REVIEW_NOTE"]}],"rights":{"attribution_checked":false,"reuse_checked":false,"notes":["Complete both checks before an approve decision."]},"decision":"needs_revision","decision_notes":["Replace placeholders and resolve blocking findings before approval."],"signature":{"method":"github_account","identifier":"REPLACE_WITH_STABLE_SIGNATURE"}}
