{"id":"review:r002:2026-08-21:ai-source-audit","schema_version":"0.1.0","created_at":"2026-08-21T06:57:00Z","target":{"type":"context_package","ids":["r002:origin-of-writing:context-package:001"]},"reviewer":{"identity_type":"ai_assistant","name":"OpenAI GPT-5.6 Pro","identifier":null,"role":"source-audit assistant","expertise":["metadata comparison","provenance tracking"],"affiliation":"OpenAI"},"reviewed_at":"2026-08-21T06:57:00Z","scope":{"evidence_ids":["ev:cdli:P002718:metadata","ev:cdli:P002718:transliteration","ev:cdli:P000014:metadata","ev:cdli:P000014:transliteration","ev:cdli:P000021:metadata","ev:cdli:P000021:transliteration","ev:secondary:damerow2006:sections-5-6","ev:secondary:damerow2006:sections-9-10"],"artifact_ids":["P002718","P000014","P000021"],"locators":["CDLI artifact metadata and revision histories","ATU 3 bibliography and plate references","Damerow 2006 §§5–10"],"editions_consulted":[{"citation":"CDLI artifact records P002718, P000014, and P000021","locator":"metadata, transliteration, revisions, and related publications"},{"citation":"Damerow 2006, CDLJ 2006:1","locator":"§§5–10"}]},"findings":[{"kind":"correction","summary":"The excerpts must retain #, ?, [...], and X uncertainty/damage markers.","blocking":false,"evidence_ids":["ev:cdli:P002718:transliteration","ev:cdli:P000014:transliteration","ev:cdli:P000021:transliteration"],"represented_in":["examples/r002-origin-of-writing.context-package.json#/evidence"]},{"kind":"disagreement","summary":"P002718 has a current Administrative label but also LGE 5 / Geography 5 links.","blocking":true,"evidence_ids":["ev:cdli:P002718:metadata"],"represented_in":["examples/r002-origin-of-writing.context-package.json#/uncertainties"]},{"kind":"limitation","summary":"The ATU 3 plates were not independently collated.","blocking":true,"evidence_ids":["ev:cdli:P002718:transliteration","ev:cdli:P000014:transliteration","ev:cdli:P000021:transliteration"],"represented_in":["examples/r002-origin-of-writing.context-package.json#/uncertainties"]}],"rights":{"attribution_checked":true,"reuse_checked":true,"notes":["No CDLI images or line art were copied.","Transliteration attribution follows the current CDLI records."]},"decision":"needs_revision","decision_notes":["AI-assisted review cannot promote the package.","A human Assyriological review of the editions and classification is required."],"signature":{"method":"github_issue","identifier":"https://github.com/Lightning-Public/ane-context-ai/issues/3"}}
